index,product,category,sub_category,brand,sale_price,market_price,type,rating_clean,description,sale_price_original,sale_price_capped,discount_pct,product_url,rating_value
19647,Eggs - White,"Eggs, Meat & Fish",Eggs,CP EVERYDAY,110.0,110.0,Farm Eggs,3.5,"CP Eggs are a natural source of high-quality protein which helps to sustain mental and physical energy throughout the day. CP Eggs consist of 13.16 gm of protein in every 100 gm of an egg.These are one of nature's most wholesome and cost-effective foods. You can bake enjoyable cakes, cookies, scones etc. with eggs; try your hand over at family pasta as well. It is twisted boiled, sunny-side up, deviled or evened. The Indian method curry eggs can be finished in so many unique tasty ways. An egg can give you a health kick in no time at all! It is the ideal ingredient to add to your child's breakfast for growth and development. Eggs can be consumed in various ways like omelettes, boiled eggs, egg bhurji and in any of the dozen egg recipe.A rich source of protein, various vitamins and amino acids, it is one of the rare food items that contain diverse nutrients. Recent studies show that eggs can prevent strokes, heart diseases and also breast cancer. They promote healthy hair and nails now that is an incentive for every woman out there!You can have them for breakfast, lunch, dinner and even as in-between snacks.",110.0,110.0,0.0,https://www.bigbasket.com/pd/40094114/cp-everyday-eggs-white-12-pcs/?nc=cl-prod-list&t_pos_sec=1&t_pos_item=1&t_s=Eggs%2520-%2520White,3.5
19741,Prawns Gassi,"Eggs, Meat & Fish",Fish & Seafood,Gadre,224.25,299.0,Frozen Fish & Seafood,3.9,Prawns Gassi is made with combining Prawns with savoury coconut curry. A savoury robust taste of Mangalorean Gassi with tender prawns. Prawns are a great source of high-quality protein and it also provides some of the most important vitamins and minerals that makes up a healthy diet.,224.25,224.25,25.0,https://www.bigbasket.com/pd/40195430/gadre-prawns-goan-curry-380-g/?nc=cl-prod-list&t_pos_sec=1&t_pos_item=2&t_s=Prawns%2520Goan%2520Curry,3.9
19855,"Tuna Flakes - Light Meat, in Salted Water","Eggs, Meat & Fish",Fish & Seafood,Tasty Nibbles,150.0,150.0,Canned Seafood,4.0,"Light meat Tuna, Water, Salt",150.0,150.0,0.0,https://www.bigbasket.com/pd/40121150/tasty-nibbles-tuna-flakes-light-meat-in-salted-water-185-g/?nc=cl-prod-list&t_pos_sec=1&t_pos_item=1&t_s=Tuna%2520Flakes%2520-%2520Light%2520Meat%252C%2520in%2520Salted%2520Water,4.0
19905,Ribbon Fish,"Eggs, Meat & Fish",Fish & Seafood,H.S. Dry Fish,60.0,60.0,Dry Fish,3.9,"The oldest traditional way of preserving fish is drying, and is still considered one of the most effective preservation methods.",60.0,60.0,0.0,https://www.bigbasket.com/pd/40036195/hs-dry-fish-ribbon-fish-100-g/?nc=cl-prod-list&t_pos_sec=1&t_pos_item=2&t_s=Ribbon%2520Fish,3.9
19971,"White Prawns - Medium, Unpeeled, 30-40 pcs","Eggs, Meat & Fish",Fish & Seafood,Fresho,259.0,500.0,Prawns & Shrimps,2.9,"Net WeightNumber Of PcsServing SizeStorage Temp500 g30-403-4 people0-4 deg celPrawns are full of nutrients. They are packed with protein and low in carbohydrate. It helps to build muscle and aids in weight-loss. The Fresho medium sea water white prawns can be used instantly to cook a variety of delicious dishes without going through the pain of cleaning and deveining them. These are seawater prawn are unpeeled. Their firm meat is easy to cook whether you are preparing curries, fried snacks, or grilled items. This comes in 30-40 pieces which are perfect for 3-4 people. Fresho is our in-house brand of fresh meat, poultry, and seafood. We take utmost care in selecting the best suppliers to provide you with high quality and succulent products. Every product is stored in our cold storage right until your doorstep ensuring freshness and utmost hygiene.",259.0,259.0,48.2,https://www.bigbasket.com/pd/10000972/fresho-white-prawns-medium-unpeeled-20-30-pcs-250-g/?nc=cl-prod-list&t_pos_sec=1&t_pos_item=1&t_s=White%2520Prawns-Medium%252C%2520Unpeeled,2.9
20018,Smoked Chicken Ham,"Eggs, Meat & Fish","Sausages, Bacon & Salami",Fresho,171.0,250.0,Chicken Sausages,3.0,"Smoked Chicken Ham is made with premium ingredients, giving you the perfect blend of flavours. Easy to cook, this is a perfect option to tame your hunger pangs. Indulge in some premium taste with Fresho.",171.0,171.0,31.6,https://www.bigbasket.com/pd/40203773/fresho-smoked-chicken-ham-200-g/?nc=cl-prod-list&t_pos_sec=1&t_pos_item=5&t_s=Smoked%2520Chicken%2520Ham,3.0
20029,Fish Fingers - Breaded,"Eggs, Meat & Fish",Fish & Seafood,Buffet ,215.0,215.0,Frozen Fish & Seafood,3.5,The buffet breade fish fingers. Deep fry in hot oil and serve the fingers hot. These fingers are made of juicy fillets rolled in breadcrumbs and make an ideal choice for evening snacks. The tasty fish fingers take very less time to cook and come in a packet of 250 grams. These low calorie fingers are delicious as well as healthy.,215.0,215.0,0.0,https://www.bigbasket.com/pd/40001197/buffet-fish-fingers-breaded-250-g-pouch/?nc=cl-prod-list&t_pos_sec=1&t_pos_item=1&t_s=Fish%2520Fingers%2520-%2520Breaded,3.5
20058,Chicken - Popcorn,"Eggs, Meat & Fish","Sausages, Bacon & Salami",Meatzza,285.0,300.0,Chicken Sausages,4.0,"Completely continental food and mostly used as a snack, the finished result is delicious and crispy in texture. It's properly packed and frozen to ensure that it retains its taste and holds the crisp once fried. Should be Kept Frozen at or below -18ºC.",285.0,285.0,5.0,https://www.bigbasket.com/pd/40049542/meatzza-chicken-popcorn-500-g/?nc=cl-prod-list&t_pos_sec=1&t_pos_item=7&t_s=Chicken%2520-%2520Popcorn,4.0
20268,Chicken Coppata Salami,"Eggs, Meat & Fish","Sausages, Bacon & Salami",ALF-FARMS,155.0,155.0,Chicken Sausages,4.4,"Savour The Delicious, Flavoursome Taste Of These Chicken Coppata Salami Slices From Alf Farms. These Slices Are Ready-To-Cook And Are Available In A Freshness-Sealed Pack. You Can Use These Salami Slices In Sandwiches, Subs, Burgers, And Hot Dogs. You Can Also Add Them To Your Many Chicken Recipes For A Unique, Delightful Taste. Broil Or Fry These Salami Slices And Cook Delicious Recipes, Or Simply Barbecue Them With Barbecue Sauce For A Tasty, Zesty Flavour.",155.0,155.0,0.0,https://www.bigbasket.com/pd/40157520/alf-farms-coppata-chicken-salami-150-g/?nc=cl-prod-list&t_pos_sec=1&t_pos_item=1&t_s=Coppata%2520Chicken%2520Salami,4.4
20372,"Mackerel Fish - Medium Whole Cleaned, Preservative Free","Eggs, Meat & Fish",Fish & Seafood,Fresho,289.0,299.0,Fresh Fish,3.0,"Net WeightNumber Of PcsServing SizeStorage Temp500 g3-43-4 people0-4 deg celMackerel fish is perfect for people who are watching their weights. The high nutritional value makes it a perfect addition to the diet. It can be grilled, steamed or baked. This whole cleaned mackerel fish comes with the head. It is cleaned and gutted. This comes in 3-4 pcs which are perfect for 3-4 people. It is preservative-free. Fresho is our in-house brand of fresh meat, poultry, and seafood. We take utmost care in selecting the best suppliers to provide you with high quality and succulent products. Every product is stored in our cold storage right until your doorstep ensuring freshness and utmost hygiene.",289.0,289.0,3.3444816053511706,https://www.bigbasket.com/pd/10000735/fresho-mackerel-fish-medium-whole-cleaned-preservative-free-500-g-tray/?nc=cl-prod-list&t_pos_sec=1&t_pos_item=1&t_s=Mackerel%2520Fish-Medium%252C%2520Whole%2520Cleaned,3.0
20423,Ayur Egg Immune,"Eggs, Meat & Fish",Eggs,Ayur Egg,60.0,60.0,Farm Eggs,2.9,"Strong immunity protects you against many diseases like common flu and fever. Eggs are a rich source of high-protein, Omega 3 and essential minerals. Ayur Immune Egg comes from hens that are fed Ayurvedic herbs like turmeric, garlic, amla, drumstick leaves that contain high nutritional and anti-oxidant properties. This ensures the hens to get essential nutrients. Moreover, they are given only minerals like organic Zinc, organic Selenium to increase the nutritional proportion of the eggs. Eggs contain antioxidants that give benefits to eye health, reduce heart disease risk and helps to maintain cholesterol. They help to boost immunity & fend off common ailments like the flu or cold and reduce risk of major illnesses.",60.0,60.0,0.0,https://www.bigbasket.com/pd/40078375/ayur-egg-ayur-egg-immune-6-pcs/?nc=cl-prod-list&t_pos_sec=1&t_pos_item=1&t_s=Ayur%2520Egg%2520Immune,2.9
20433,Prawns - Pd Jumbo,"Eggs, Meat & Fish",Fish & Seafood,Seastar,310.0,310.0,Frozen Fish & Seafood,3.2,Seastar Prawns - Pd Jumbo 250 g,310.0,310.0,0.0,https://www.bigbasket.com/pd/40018657/seastar-prawns-pd-jumbo-250-g-pouch/?nc=cl-prod-list&t_pos_sec=1&t_pos_item=1&t_s=Prawns%2520-%2520Pd%2520Jumbo,3.2
20592,Pork - Traditional String Chorizo Chilly,"Eggs, Meat & Fish","Sausages, Bacon & Salami",Fresho Signature,513.0,570.0,Pork & Ham,4.1,"Casanova traditional String Chorizo Chilly flavour is rich red colour sausage from Pimentos, which is a very spicy smoked Spanish paprika. Uncooked chorizo is soft to touch, when cooked it releases a delicious spicy red oil. Recipes using chorizo do not need additional oil to be added to the pan. Spiced pork sausage is widely used in Spanish and Mexican cooking. Manufactured at Spain. Packed as per Customer requirement. Not a standard pack under weights & Measurement Guidelines. Consume within 05 days from date of Packing. Store in refrigerator at or below 05 degree C in an airtight container.",513.0,513.0,10.0,https://www.bigbasket.com/pd/40094830/fresho-signature-pork-cured-chorizo-chilly-sliced-100-g/?nc=cl-prod-list&t_pos_sec=1&t_pos_item=1&t_s=Pork%2520-%2520Cured%2520Chorizo%2520Chilly%252C%2520Sliced,4.1
20703,Imitation - Fish Popups,"Eggs, Meat & Fish",Fish & Seafood,Gadre,166.5,185.0,Frozen Fish & Seafood,4.0,"Completely continental food and mostly used as a snack, the finished result is delicious and crispy in texture. It is properly packed and frozen to ensure that it retains its taste and holds the crisp once fried. Should be Kept Frozen at or below -18 C.",166.5,166.5,10.0,https://www.bigbasket.com/pd/40049576/gadre-imitation-fish-popups-250-g/?nc=cl-prod-list&t_pos_sec=1&t_pos_item=1&t_s=Imitation%2520-%2520Fish%2520Popups,4.0
20717,Chicken Seekh Kabab - Pahadi,"Eggs, Meat & Fish","Sausages, Bacon & Salami",Fresho,207.9,270.0,Chicken Sausages,3.7,"Kebabs are popular all over the world for all the right reasons. Seekh Kababs are a very popular appetiser and delicacy in most parts of the world. They are made from tender meat, add some masalas and seasoning, put it on a skewer and grilled them golden. These are not only delicious and tasty but easy to eat but are also full of health, especially if you make them the ‘healthy way’. This Chicken Seekh Kebabs requires just a few minutes of your time and believe us, each effort that goes into making them is so worth it. Get your hands on Fresho Chicken Seekh Kabab and start cooking this mouth-watering and delicious Kebabs and serve them with hot parathas and green chutney.

Chicken kebabs are one of the most valued foods among people of all ages, throughout the world. 
Not only it forms a crucial part of various culinary traditions but it is also highly nutritious and delicious to taste. 
Seekh Kababs are a very popular appetiser and delicacy non-vegetarian snacks to be served quickly in most parts of the world.",207.9,207.9,23.0,https://www.bigbasket.com/pd/40205804/fresho-chicken-seekh-kabab-pahadi-500-g/?nc=cl-prod-list&t_pos_sec=1&t_pos_item=2&t_s=Chicken%2520Seekh%2520Kabab%252FKebab%252C%2520Pahadi,3.7
20757,"Farm Eggs - Brown, Medium, Antibiotic Residue-Free","Eggs, Meat & Fish",Eggs,Fresho,74.0,85.0,Protein Eggs,3.3,"Number of PcsSize6 pcsMediumEggs are one of the common food items in most of the households. From breakfast to dinner, eggs are indulged in various ways. Poached, boiled, fried; we all have our own favourite choices. Not only are they delicious, but they are also crammed with health benefits. It is one of the most in-expensive sources of high protein. These are one of nature's most wholesome and cost-effective foods. An egg can give you a health kick in no time at all! It is the ideal ingredient to add to your child's breakfast for growth and development. The Add-on Benefits of Fresho Egg: •Antibiotic free •Free from growth hormones •Carefully selected •Rich in omega 3 Fresho is our in-house brand of fresh meat, poultry, and seafood. We take utmost care in selecting the best suppliers to provide you with high quality and succulent products. Every product is stored in our cold storage right until your doorstep ensuring freshness and utmost hygiene.",74.0,74.0,12.941176470588236,https://www.bigbasket.com/pd/40185809/fresho-farm-no-hatch-herbal-eggs-medium-antibiotic-residue-free-6-pcs-box/?nc=cl-prod-list&t_pos_sec=1&t_pos_item=1&t_s=Farm%2520No-Hatch%2520Herbal%2520Eggs%2520-%2520Medium%252C%2520Antibiotic%2520Residue-Free,3.3
20778,"Pork - Proscicutto Crudo Full, P.G.I, Sliced","Eggs, Meat & Fish","Sausages, Bacon & Salami",Fresho Signature,603.6,670.67,Pork & Ham,4.1,"Dautore Prosciutto was first produced by Romans and is one of the oldest Italian deli meats. It was the Romans who left the first written descriptions of its production (cured). According to Italian tradition, large legs need to be used in order to obtain more mature meat, that contains less water. This condition is only passed by prosciutti crudi. They are marked as PDO or PGI once it has matured . Fresho Signature ProscicuttoCrudo Full P.G.I. is produced under the desired conditions to give it the authentic flavour. Manufactured at Italy. Packed as per Customer requirement. Not a standard pack under weights & Measurement Guidelines. Consume within 05 days from date of Packing. Store in refrigerator at or below 05 degree C in an airtight container.",603.6,603.6,10.00044731388014,https://www.bigbasket.com/pd/40094830/fresho-signature-pork-cured-chorizo-chilly-sliced-100-g/?nc=cl-prod-list&t_pos_sec=1&t_pos_item=1&t_s=Pork%2520-%2520Cured%2520Chorizo%2520Chilly%252C%2520Sliced,4.1
20846,Canned Sardine - in Natural Oil,"Eggs, Meat & Fish",Fish & Seafood,Golden Prize,75.05,79.0,Canned Seafood,4.3,"Golden Prize Canned Sardine in Natural Oil is rich in Omega 3 and can be used to prepare a variety of delicious dishes, or can be eaten straight from the can. These sardines are a product of Thailand and come in an easy to open lid can. They are dolphin safe and HACCP compliant.",75.05,75.05,5.000000000000004,https://www.bigbasket.com/pd/40119299/golden-prize-canned-sardine-in-natural-oil-125-g/?nc=cl-prod-list&t_pos_sec=1&t_pos_item=2&t_s=Canned%2520Sardine%2520-%2520in%2520Natural%2520Oil,4.3
20896,Tuna Flakes - in Soya Bean Oil,"Eggs, Meat & Fish",Fish & Seafood,Golden Prize,147.25,155.0,Canned Seafood,4.4,,147.25,147.25,5.0,https://www.bigbasket.com/pd/40124074/golden-prize-tuna-flakes-in-soya-bean-oil-185-g/?nc=cl-prod-list&t_pos_sec=1&t_pos_item=1&t_s=Tuna%2520Flakes%2520-%2520in%2520Soya%2520Bean%2520Oil,4.4
20956,"Prawns - Large, Peeled & Deveined","Eggs, Meat & Fish",Fish & Seafood,ITC Master Chef,250.0,250.0,Frozen Fish & Seafood,4.0,"Soft & juicy, super safe prawns-adherence to European, America, Japan & Indian Standards. Make your favourite dishes with this super tasty prawns.243 tests conducted for ITC master chef prawn’s v/s 16 tests required for FSSAI.",250.0,250.0,0.0,https://www.bigbasket.com/pd/40110125/itc-master-chef-prawns-large-peeled-deveined-200-g/?nc=cl-prod-list&t_pos_sec=1&t_pos_item=1&t_s=Large%2520Prawns%252C%2520Peeled%252C%2520Deveined,4.0
20967,Frozen Salmon Skin-on Portions,"Eggs, Meat & Fish",Fish & Seafood,Big Sams,960.0,960.0,Frozen Fish & Seafood,3.1,"Salmon Skin-on Portions makes the perfect meal for 2. It contains nutritious Omega-3 fatty acids, Salmon is one of the healthiest proteins one can eat. It is flown in directly from Norway, so it is never too far from its date of production. Perfect for grilling.",960.0,960.0,0.0,https://www.bigbasket.com/pd/40084540/big-sams-frozen-salmon-skin-on-portions-250-g/?nc=cl-prod-list&t_pos_sec=1&t_pos_item=1&t_s=Frozen%2520Salmon%2520Skin-on%2520Portions,3.1
21063,Chicken Zing - Hot,"Eggs, Meat & Fish","Sausages, Bacon & Salami",Blue Flame,254.15,299.0,Chicken Sausages,4.0,This is a unique blend of chicken breast filet perfectly coated with breadcrumbs. A perfect appetizer evening refreshment and party snack. You will not just be able to resist the zing hot with spice flavour.,254.15,254.15,15.0,https://www.bigbasket.com/pd/40157309/blue-flame-chicken-zing-hot-350-g/?nc=cl-prod-list&t_pos_sec=1&t_pos_item=2&t_s=Chicken%2520Zing%2520-%2520Hot,4.0
21111,"Pork - Spanish Toast Ham, Sliced","Eggs, Meat & Fish","Sausages, Bacon & Salami",Fresho Signature,158.4,176.0,Pork & Ham,3.9,Casanova Spanish Toast Ham is a perfectly shaped ham for bread loaf slices. It has been sliced in a way to make your work easier. Manufactured at Spain. Packed as per Customer requirement. Not a standard pack under weights & Measurement Guidelines. Consume within 05 days from date of Packing. Store in refrigerator at or below 05 degree C in an airtight container.,158.4,158.4,9.999999999999996,https://www.bigbasket.com/pd/40094813/fresho-signature-pork-smoked-breakfast-ham-sliced-200-g/?nc=cl-prod-list&t_pos_sec=1&t_pos_item=1&t_s=Pork%2520-%2520Smoked%2520Breakfast%2520Ham%252C%2520Sliced,3.9
21115,Chicken Cocktail Sausage,"Eggs, Meat & Fish","Sausages, Bacon & Salami",La Carne,275.0,275.0,Chicken Sausages,4.1,"At La Carne, we take pride in offering products of high quality. La Carne brings to you the authentic taste of premium Chicken Products. Quick Freezing technology used to preserve all the goodness and freshness inside. Made with lean ground chicken with the low fat, perfect snack for party serving or regular snacking.",275.0,275.0,0.0,https://www.bigbasket.com/pd/40161835/la-carne-chicken-cocktail-sausage-500-g-pkt/?nc=cl-prod-list&t_pos_sec=1&t_pos_item=2&t_s=Chicken%2520Cocktail%2520Sausage,4.1
21315,Chicken - Seek Kabab,"Eggs, Meat & Fish","Sausages, Bacon & Salami",Meatzza,325.0,325.0,Chicken Sausages,4.2,It's an Indian delicacy with the rich aroma with some uncommon spices and fresh poultry. The finished result is delicious and milder in flavor than the amount of spices would predict. Can be eaten as a snack. It's properly packed and frozen to ensure that it retains its taste and aroma. Should be Kept Frozen at or below -18ºC.,325.0,325.0,0.0,https://www.bigbasket.com/pd/40059419/meatzza-chicken-seekh-kebab-1-kg/?nc=cl-prod-list&t_pos_sec=1&t_pos_item=11&t_s=Chicken%2520-%2520Seekh%2520Kebab,4.2
21324,The Good Eggs Cage Free Eggs,"Eggs, Meat & Fish",Eggs,UPF,99.0,99.0,Farm Eggs,3.8,"These are the most affordable large and fresh cage-free eggs that are produced in our newly set up cage-free farms. Its produced in an environment where hens are confined to the same area. These hens are fed with a well-balanced diet which does not contain any antibiotics, growth hormones or any other substance.",99.0,99.0,0.0,https://www.bigbasket.com/pd/40161156/upf-the-good-eggs-cage-free-eggs-6-pcs/?nc=cl-prod-list&t_pos_sec=1&t_pos_item=1&t_s=The%2520Good%2520Eggs%2520Cage%2520Free%2520Eggs,3.8
21357,Catla Fish Large Curry Cut 1kg+Chicken Breast Boneless 500G+Chicken Mince 500G,"Eggs, Meat & Fish",Fish & Seafood,Fresho,760.0,1123.0,Fresh Fish,4.0,"Whole fish weight arround 2.5 kg to 4 kg
 Fresho Boneless Chicken Breast Meat is not only tasty and good for health, but also it is packed with nutrition which makes it all the more desired. The small boneless chunks take less time to cook and can be used in both Indian and Continental dishes. Depending on your choice of food, you can prepare the gravy or sauce and simply cook the chicken in it.  The juicy and tasty meat of the Chicken Mince brings great taste to the platters. It is an excellent basis of vitamin B6, antioxidants and protein. It also contains niacin, selenium and phosphorous. It is low in cholesterol and fat and is carb-free. Moreover, it possesses cancer-preventing properties. It helps in preparing quick recipes like tikka, kebabs, and extra.",760.0,760.0,32.32413178984862,https://www.bigbasket.com/pd/40263033/fresho-chicken-sausages-masala-ready-to-fry-rich-in-protein-500-g/?nc=cl-prod-list&t_pos_sec=1&t_pos_item=9&t_s=Chicken%2520Sausage%252C%2520Masala,4.0
21375,Fresh Catch Breaded Fish Fillets,"Eggs, Meat & Fish",Fish & Seafood,Ifb,187.0,220.0,Frozen Fish & Seafood,4.1,"100% real fish, 1000% delicious! Our Breaded Fish Fillets have golden-crisped, crunchy flavour. It’s no wonder that these flaky fillets are a classic family favourite.",187.0,187.0,15.0,https://www.bigbasket.com/pd/40003219/ifb-fresh-catch-breaded-fish-fillets-200-g-carton/?nc=cl-prod-list&t_pos_sec=1&t_pos_item=1&t_s=Fresh%2520Catch%2520Breaded%2520Fish%2520Fillets,4.1
21605,Canned Skipjack Light Meat Tuna - Chunk In Olive Oil,"Eggs, Meat & Fish",Fish & Seafood,Golden Prize,205.0,205.0,Canned Seafood,4.3,"Premium Quality Fish, Imported from Thailand, Excellent source of Omega 3 , Dolphin Friendly",205.0,205.0,0.0,https://www.bigbasket.com/pd/40037992/golden-prize-canned-skipjack-light-meat-tuna-chunk-in-olive-oil-185-g/?nc=cl-prod-list&t_pos_sec=1&t_pos_item=1&t_s=Canned%2520Skipjack%2520Light%2520Meat%2520Tuna%2520-%2520Chunk%2520In%2520Olive%2520Oil,4.3
21656,"Sausage - Pork, Cocktail","Eggs, Meat & Fish",Pork & Other Meats,Quickee'S,230.0,230.0,Pork & Ham,3.8,Quickee presents their deliciously mouth-watering range of meat products which will enchant your taste buds and leave you craving for more as you rake up your favourite meals. Make your morning breakfasts more exciting by serving Quickees Pork Cocktail Sausages along with eggs and toast for a scrumptious and a healthy meal.,230.0,230.0,0.0,https://www.bigbasket.com/pd/40125075/quickees-sausage-pork-goan-275-g/?nc=cl-prod-list&t_pos_sec=1&t_pos_item=6&t_s=Sausage%2520-%2520Pork%252C%2520Goan,3.8
21701,"Ham - Chicken Breast, Smoked","Eggs, Meat & Fish","Sausages, Bacon & Salami",La Carne,250.0,250.0,Chicken Sausages,3.9,"Chicken Breast, Water, Edible Common Salt, Dextrose, Emulsifier-E407, E451, E452, Antioxidant-E316, Colour Fixative-E250 Contains permitted natural flavour.",250.0,250.0,0.0,https://www.bigbasket.com/pd/40063445/la-carne-ham-chicken-breast-smoked-220-g-pouch/?nc=cl-prod-list&t_pos_sec=1&t_pos_item=1&t_s=Ham%2520-%2520Chicken%2520Breast%252C%2520Smoked,3.9
21713,Shark,"Eggs, Meat & Fish",Fish & Seafood,H.S. Dry Fish,70.0,70.0,Dry Fish,3.5,"The oldest traditional way of preserving fish is drying, and is still considered one of the most effective preservation methods.",70.0,70.0,0.0,https://www.bigbasket.com/pd/40036198/hs-dry-fish-shark-80-g/?nc=cl-prod-list&t_pos_sec=1&t_pos_item=1&t_s=Shark,3.5
21845,Chicken - Cheese N Onion Sausages,"Eggs, Meat & Fish","Sausages, Bacon & Salami",Zorabian,170.0,170.0,Chicken Sausages,4.3,Made from Fresh Breast Boneless Meat it has just the right balance of Cheese n Onion FlavouringÃƒÆ’Ã‚Â¢ÃƒÂ¢Ã¢â‚¬Å¡Ã‚Â¬ÃƒÂ¢Ã¢â‚¬Å¾Ã‚Â¢s... It is Subtle and Delicious and makes for a great cocktail snack at parties.,170.0,170.0,0.0,https://www.bigbasket.com/pd/40020423/zorabian-chicken-cheese-n-onion-sausages-250-g-pouch/?nc=cl-prod-list&t_pos_sec=1&t_pos_item=1&t_s=Chicken%2520-%2520Cheese%2520N%2520Onion%2520Sausages,4.3
21911,"Prawns - Super Large, Peeled & Deveined","Eggs, Meat & Fish",Fish & Seafood,ITC Master Chef,275.0,275.0,Frozen Fish & Seafood,4.0,"Soft & juicy, super safe prawns-adherence to European, America, Japan & Indian Standards. Make your favourite dishes with this super tasty prawns.243 tests conducted for ITC master chef prawn’s v/s 16 tests required for FSSAI.",275.0,275.0,0.0,https://www.bigbasket.com/pd/40110125/itc-master-chef-prawns-large-peeled-deveined-200-g/?nc=cl-prod-list&t_pos_sec=1&t_pos_item=1&t_s=Large%2520Prawns%252C%2520Peeled%252C%2520Deveined,4.0
22061,"Pork - Salami Milano, Sliced","Eggs, Meat & Fish","Sausages, Bacon & Salami",Fresho Signature,269.4,299.33,Pork & Ham,3.2,"Dautore Salami Milano is produced by mixing light pork meat with heavy fat. These ingredients are finely ground and the same spices are again mixed and finally cased inside artificial large cases. All Italian salamis are differentiated on the basis of type of meat grinding (fine, medium or coarse) and the spices and ingredients (garlic, chilli pepper, fennel seeds) used. They give each individual type of Salami, a very specific personality and shape. Manufactured at Italy. Packed as per Customer requirement. Not a standard pack under weights & Measurement Guidelines. Consume within 05 days from date of Packing. Store in refrigerator at or below 05 degree C in an airtight container.",269.4,269.4,9.998997761667727,n/a,3.2
22184,Chicken - Cheese & Chili,"Eggs, Meat & Fish","Sausages, Bacon & Salami",Bon Appetit,379.0,399.0,Chicken Sausages,4.0,"EAN Code: 8908002778311  Country of origin: India  Manufactured & Marketed by: Arthur's Food Company Private Limited, NO 14H KIADB Industrial area, Attibele,Bangalore - 562107, Karnataka, India  Best before 18-10-2021  For Queries/Feedback/Complaints, Contact our Customer Care Executive at: Phone: 1860 123 1000 | Address: Innovative Retail Concepts Private Limited, No.18, 2nd & 3rd Floor, 80 Feet Main Road, Koramangala 4th Block, Bangalore - 560034 | Email: customerservice@bigbasket.com",379.0,379.0,5.012531328320802,https://www.bigbasket.com/pd/40211361/prasuma-chicken-cheese-chiili-sausage-beechwood-smoked-250-g/?nc=cl-prod-list&t_pos_sec=1&t_pos_item=19&t_s=Frozen%2520Chicken%2520Cheese%2520%2526%2520Chilli%2520Sausage,4.0
