index,product,category,sub_category,brand,sale_price,market_price,type,rating_clean,description,sale_price_original,sale_price_capped,discount_pct,product_url,rating_value
10625,Chicken - Nuggets,"Eggs, Meat & Fish","Sausages, Bacon & Salami",Meatzza,285.0,300.0,Chicken Sausages,4.0,"Completely continental food and mostly used a snack, the finished result is delicious and crispy in texture. It's properly packed and frozen to ensure that it retains its taste and holds the crisp once fried. Should be Kept Frozen at or below -18Ã‚ÂºC.",285.0,285.0,5.0,https://www.bigbasket.com/pd/40049529/meatzza-chicken-nuggets-500-g/?nc=cl-prod-list&t_pos_sec=1&t_pos_item=2&t_s=Chicken%2520-%2520Nuggets,4.0
10736,"Tuna Flakes - White Meat In Water, Salt Added","Eggs, Meat & Fish",Fish & Seafood,Tasty Nibbles,190.0,190.0,Canned Seafood,4.4,"Ready to Eat Canned White Meat Tuna from yellowfin is a healthy and tastier meal. Rich in Omega 3, Proteins, Potassium, Magnesium, Iron, Vitamin A, B16 & B12, it comes with no preservative and no odour. It is zero carbs/sugar-free and unopened and it can be kept at room temperature. It comes with HACCP, Halal, and Japanese Technology.",190.0,190.0,0.0,https://www.bigbasket.com/pd/40176768/tasty-nibbles-tuna-flakes-white-meat-in-water-salt-added-185-g-can/?nc=cl-prod-list&t_pos_sec=1&t_pos_item=1&t_s=Tuna%2520Flakes%2520-%2520White%2520Meat%2520In%2520Water%252C%2520Salt%2520Added,4.4
10784,Mackeral Fish,"Eggs, Meat & Fish",Fish & Seafood,H.S. Dry Fish,60.0,60.0,Dry Fish,3.0,"The oldest traditional way of preserving fish is drying, and is still considered one of the most effective preservation methods.",60.0,60.0,0.0,https://www.bigbasket.com/pd/40036188/hs-dry-fish-mackeral-fish-100-g/?nc=cl-prod-list&t_pos_sec=1&t_pos_item=1&t_s=Mackeral%2520Fish,3.0
10882,Korai Fish,"Eggs, Meat & Fish",Fish & Seafood,H.S. Dry Fish,42.5,50.0,Dry Fish,3.9,"The oldest traditional way of preserving fish is drying, and is still considered one of the most effective preservation methods.",42.5,42.5,15.0,https://www.bigbasket.com/pd/40036197/hs-dry-fish-korai-fish-100-g/?nc=cl-prod-list&t_pos_sec=1&t_pos_item=1&t_s=Korai%2520Fish,3.9
10926,"Pearl Spot Fish - Medium, Whole, Preservative Free, 3-4 pcs","Eggs, Meat & Fish",Fish & Seafood,Fresho,373.75,373.75,Fresh Fish,3.1,"Net WeightNumber Of PcsServing SizeStorage Temp500 g3-43-4 people0-4 deg celPearl Spot Fish is widely available in Kerala and Tamil Nadu. This is considered as one of the authentic dishes of Kerela. These fishes have a high protein content and have low fat. Thus, making it a perfect item to include in your diet. This whole cleaned pearl spot fish comes with the head. It is cleaned and gutted. This comes in 3-4 pcs which are perfect for 3-4 people. It is preservative-free. Fresho is our in-house brand of fresh meat, poultry, and seafood. We take utmost care in selecting the best suppliers to provide you with high quality and succulent products. Every product is stored in our cold storage right until your doorstep ensuring freshness and utmost hygiene.",373.75,373.75,0.0,https://www.bigbasket.com/pd/10000708/fresho-pearl-spot-fish-medium-whole-preservative-free-3-4-pcs-500-g-tray/?nc=cl-prod-list&t_pos_sec=1&t_pos_item=2&t_s=Pearl%2520Spot%2520Fish-Medium%252C%2520Whole,3.1
10960,Brown Egg - Veg Feed & Extra Albumen,"Eggs, Meat & Fish",Eggs,Best,80.0,84.0,Protein Eggs,3.5,"Best brown eggs is a natural pigment placed by the hen on the surface of the shell during the final stages of egg formation. From the inside, the shell appears white. The outer shell colour can vary from light to dark brown, depending on the breed of the hen and also on individual hen characteristics.",80.0,80.0,4.761904761904762,https://www.bigbasket.com/pd/40003817/best-brown-egg-veg-feed-extra-albumen-6-pcs-pouch/?nc=cl-prod-list&t_pos_sec=1&t_pos_item=1&t_s=Brown%2520Eggs,3.5
10965,Sardine In Vegetable Oil,"Eggs, Meat & Fish",Fish & Seafood,Indofish,75.0,75.0,Canned Seafood,3.9,"Indofish Sardine in Vegetable Oil  is ready to eat and is a rich source of Omega 3. It comes with an easy to open lid and can be stored for longer than fresh fish. It is an ideal ingredient to be used for preparing flavourful fish curries, salads or pastas.",75.0,75.0,0.0,https://www.bigbasket.com/pd/40010031/ocean-secret-sardines-in-vegetable-oil-with-lemon-slices-180-g-tin/?nc=cl-prod-list&t_pos_sec=1&t_pos_item=1&t_s=Sardines%2520-%2520In%2520Vegetable%2520Oil%2520With%2520Lemon%2520Slices,3.9
10976,Sausage - Pork,"Eggs, Meat & Fish",Pork & Other Meats,Quickee'S,230.0,230.0,Pork & Ham,3.8,Quickee presents their deliciously mouth-watering range of meat products which will enchant your taste buds and leave you craving for more as you rake up your favourite meals. Make your morning breakfasts more exciting by serving Quickees Pork Sausages along with eggs and toast for a scrumptious and a healthy meal.,230.0,230.0,0.0,https://www.bigbasket.com/pd/40125075/quickees-sausage-pork-goan-275-g/?nc=cl-prod-list&t_pos_sec=1&t_pos_item=1&t_s=Sausage%2520-%2520Pork%252C%2520Goan,3.8
11081,Chicken - Burger,"Eggs, Meat & Fish","Sausages, Bacon & Salami",Meatzza,260.0,275.0,Chicken Sausages,4.1,Meatzza Breaded Chicken Burger are made from tender chicken meat which gives you tasty and juicy bite.,260.0,260.0,5.454545454545454,https://www.bigbasket.com/pd/40049541/meatzza-chicken-burger-patty-500-g/?nc=cl-prod-list&t_pos_sec=1&t_pos_item=2&t_s=Chicken%2520Burger%2520Patty,4.1
11092,Cardio Egg - Low Cholesterol Good For Heart,"Eggs, Meat & Fish",Eggs,Best,84.0,84.0,Other Eggs,2.9,"Best Cardio Egg includes 6 fresh and secure eggs. It is pesticide and anti-biotic free without bad odour. It is UV treated fresh eggs that are free of crack and blood spots. It is famous wealthy source of protein. It is an important building block of bones, cartilage, muscles, skin, and blood. It is a wealthy source of vitamins, phosphorous, calcium, lecithin and iron. It is excellent for the heart due to the presence of low cholesterol.",84.0,84.0,0.0,n/a,2.9
11186,Plus Egg - Veg Feed & No Bad Odour,"Eggs, Meat & Fish",Eggs,Best,69.3,73.0,Farm Eggs,3.6,"Best Plus Egg are hygienically processed and safely packed for keeping these free from any contamination and impurity. It has high nutritional content, protein, aroma and rich taste. These are one of nature's most nutritious and economical foods.",69.3,69.3,5.068493150684936,https://www.bigbasket.com/pd/40003813/best-plus-egg-veg-feed-no-bad-odour-12-pcs-pouch/?nc=cl-prod-list&t_pos_sec=1&t_pos_item=1&t_s=Plus%2520Eggs,3.6
11414,Chicken Seekh Kabab Malai N Cheese,"Eggs, Meat & Fish","Sausages, Bacon & Salami",Fresho,223.0,290.0,Chicken Sausages,3.9,"Prepared in the traditional style, these malai and cheese kebabs are made with the finest ingredients. Enjoy these delicious kababs at the convenience of your home. Perfect as a starter, relish these mouth-watering delight with your loved ones. Fresho is our in-house brand of fresh meat, poultry, and seafood. We take utmost care in selecting the best suppliers to provide you with high quality and succulent products. Every product is stored in our cold storage right until your doorstep ensuring freshness and utmost hygiene.",223.0,223.0,23.103448275862068,https://www.bigbasket.com/pd/40197980/fresho-chicken-seekh-kabab-malai-n-cheese-500-g/?nc=cl-prod-list&t_pos_sec=1&t_pos_item=1&t_s=Chicken%2520Seekh%2520Kabab%252FKebab%252C%2520Malai%2520N%2520Cheese,3.9
11418,Chicken Cheese & Chiili  Sausage - Beechwood Smoked,"Eggs, Meat & Fish","Sausages, Bacon & Salami",Prasuma,180.0,180.0,Chicken Sausages,4.0,"Made from lightly seasoned chicken with delicious chunks of real Swiss Cheese, made from select cuts of chicken and a special blend of seasoning. As the name suggests, these sausages are the perfect addition to any other meal. Eat Better with Prasuma: Vacuum Packed and Sealed, Antibiotic Residue & Hormone Free Meat, Temperature Controlled Processing.",180.0,180.0,0.0,https://www.bigbasket.com/pd/40211361/prasuma-chicken-cheese-chiili-sausage-beechwood-smoked-250-g/?nc=cl-prod-list&t_pos_sec=1&t_pos_item=19&t_s=Frozen%2520Chicken%2520Cheese%2520%2526%2520Chilli%2520Sausage,4.0
11429,"Pork - Ham BBQ, Sliced","Eggs, Meat & Fish","Sausages, Bacon & Salami",Fresho Signature,217.2,241.33,Pork & Ham,3.0,"Bauwens BBQ ham has been slow-smoked for a minimum of 14 hours with natural hickory. The process is followed to give it a rich mahogany color, deep aroma and fantastic smoked flavor. Manufactured at USA. Packed as per Customer requirement. Not a standard pack under weights & Measurement Guidelines. Consume within 05 days from date of Packing. Store in refrigerator at or below 05 degree C in an airtight container.",217.2,217.2,9.998756888907314,n/a,3.0
11455,Fish Fillets - Raw Meet,"Eggs, Meat & Fish",Fish & Seafood,Buffet ,318.75,375.0,Frozen Fish & Seafood,3.9,"The buffet farm fresh - fish fillets. Its very delicious and taste best when cooked. Its contains two pieces which are frozen raw. They are 100% natural farm grown fish. This premium white meat has 0% transfat, which is good for your health.",318.75,318.75,15.0,https://www.bigbasket.com/pd/40001200/buffet-fish-fillets-raw-meet-450-g-pouch/?nc=cl-prod-list&t_pos_sec=1&t_pos_item=1&t_s=Fish%2520Fillets%2520-%2520Raw%2520Meet,3.9
11485,"Fish - Katla, Head","Eggs, Meat & Fish",Fish & Seafood,Fresho,59.0,129.0,Fresh Fish,3.0,"Fish heads, separated of the fish, are sometimes used in food dishes, or boiled for fish stock.",59.0,59.0,54.26356589147287,https://www.bigbasket.com/pd/40087794/fresho-fish-katla-head-500-g/?nc=cl-prod-list&t_pos_sec=1&t_pos_item=1&t_s=Catla%2520Fish%2520Head,3.0
11593,Fresh Boneless Chicken Thighs,"Eggs, Meat & Fish","Sausages, Bacon & Salami",Meatzza,260.0,260.0,Chicken Sausages,3.2,"Leg pieces processed from dressed whole bird. Very soft and tender in nature, ideal for roasting and good to use in dry heat. Should be Kept Frozen at or below -18 C",260.0,260.0,0.0,https://www.bigbasket.com/pd/40055085/meatzza-fresh-boneless-chicken-thighs-500-g/?nc=cl-prod-list&t_pos_sec=1&t_pos_item=1&t_s=Fresh%2520Boneless%2520Chicken%2520Thighs,3.2
11754,Pork - Garlic Sausage,"Eggs, Meat & Fish","Sausages, Bacon & Salami",Fresho Signature,187.2,208.0,Pork & Ham,2.8,Goldi Finest the delicious and healthy Fresho Signature Pork Sausage consists of very little fat. It is a fully cooked sausage and makes a fantastic and hassle-free meal. It is made of ground meat mixed with spices and garlic. Manufactured at Srilanka. Packed as per Customer requirement. Not a standard pack under weights & Measurement Guidelines. Consume within 05 days from date of Packing. Store in refrigerator at or below 05 degree C in an airtight container.,187.2,187.2,10.000000000000004,https://www.bigbasket.com/pd/40094887/fresho-signature-pork-garlic-sausage-200-g/?nc=cl-prod-list&t_pos_sec=1&t_pos_item=1&t_s=Pork%2520-%2520Garlic%2520Sausage,2.8
11862,Chicken - Cocktail Pepper Sausages,"Eggs, Meat & Fish","Sausages, Bacon & Salami",Zorabian,170.0,170.0,Chicken Sausages,4.3,ZorabianÃƒÆ’Ã‚Â¢ÃƒÂ¢Ã¢â‚¬Å¡Ã‚Â¬ÃƒÂ¢Ã¢â‚¬Å¾Ã‚Â¢s Chicken Cocktail Pepper Sausages have just the right flavouring of Pepper ÃƒÆ’Ã‚Â¢ÃƒÂ¢Ã¢â‚¬Å¡Ã‚Â¬ÃƒÂ¢Ã¢â€šÂ¬Ã…â€œ Making it a breakfast favourite.,170.0,170.0,0.0,https://www.bigbasket.com/pd/40020426/zorabian-chicken-cocktail-pepper-sausages-250-g-pouch/?nc=cl-prod-list&t_pos_sec=1&t_pos_item=2&t_s=Chicken%2520-%2520Cocktail%2520Pepper%2520Sausages,4.3
11954,Chicken Seekh Kabab - Onion,"Eggs, Meat & Fish","Sausages, Bacon & Salami",Fresho,237.9,305.0,Chicken Sausages,5.0,"Kebabs are popular all over the world for all the right reasons. Seekh Kababs are a very popular appetiser and delicacy in most parts of the world. They are made from tender meat, add some masalas and seasoning, put it on a skewer and grilled them golden. These are not only delicious and tasty, but easy to eat but are also full of health, especially if you make them the ‘healthy way’. This Chicken Seekh Kebabs requires just a few minutes of your time and believe us, each effort that goes into making them is so worth it. Get your hands on Fresho Chicken Seekh Kabab and start cooking this mouth-watering and delicious Kebabs and serve them with hot parathas and green chutney.

Chicken kebabs are one of the most valued foods among people of all ages, throughout the world. 
Not only it forms a crucial part of various culinary traditions but it is also highly nutritious and delicious to taste. 
Seekh Kababs are a very popular appetiser and delicacy non-vegetarian snacks to be served quickly in most parts of the world.",237.9,237.9,22.0,https://www.bigbasket.com/pd/40340599/fresho-chicken-seekh-kabab-onion-350-g/?nc=cl-prod-list&t_pos_sec=1&t_pos_item=3&t_s=Chicken%2520Seekh%2520Kabab%2520-%2520Onion,5.0
11962,Sausage - Pork,"Eggs, Meat & Fish","Sausages, Bacon & Salami",Tannys,225.0,225.0,Pork & Ham,3.0,Processed Pre Cooked,225.0,225.0,0.0,https://www.bigbasket.com/pd/40083750/tannys-sausage-pork-250-g/?nc=cl-prod-list&t_pos_sec=1&t_pos_item=1&t_s=Sausage%2520-%2520Pork,3.0
11978,Prawns - Pud Large,"Eggs, Meat & Fish",Fish & Seafood,Seastar,230.0,230.0,Frozen Fish & Seafood,2.9,Seastar Prawns - Pud Large 250 g,230.0,230.0,0.0,https://www.bigbasket.com/pd/40018660/seastar-prawns-pud-large-250-g-pouch/?nc=cl-prod-list&t_pos_sec=1&t_pos_item=1&t_s=Prawns%2520-%2520Pud%2520Large,2.9
11983,Chicken Salami Plain,"Eggs, Meat & Fish","Sausages, Bacon & Salami",Fresho,192.5,250.0,Chicken Sausages,4.0,"Chicken Salami Plain  is made with premium ingredients, giving you the perfect blend of flavours. Easy to cook, this is a perfect option to tame your hunger pangs. Indulge in some premium taste with Fresho.",192.5,192.5,23.0,https://www.bigbasket.com/pd/40263040/fresho-chicken-salami-sliced-plain-ready-to-fry-rich-in-protein-500-g/?nc=cl-prod-list&t_pos_sec=1&t_pos_item=2&t_s=Chicken%2520Salami%2520Sliced%252C%2520Plain,4.0
12037,Sardine In Soy Sauce,"Eggs, Meat & Fish",Fish & Seafood,Golden Prize,103.55,109.0,Canned Seafood,4.4,"Golden Prize Sardine in Soy Sauce is ready to eat and is a rich source of Omega 3. It comes with an easy to open lid and can be stored for longer than fresh fish. It is an ideal ingredient to be used for preparing flavourful fish curries, salads or pastas.",103.55,103.55,5.000000000000003,https://www.bigbasket.com/pd/40096825/golden-prize-canned-sardine-in-tomato-sauce-200-g/?nc=cl-prod-list&t_pos_sec=1&t_pos_item=1&t_s=Canned%2520Sardine%2520in%2520Tomato%2520Sauce,4.4
12180,Fish Fingers,"Eggs, Meat & Fish",Fish & Seafood,Gadre,650.0,650.0,Frozen Fish & Seafood,4.1,"Completely continental food and mostly used as a snack, the finished result is delicious and crispy in texture. It is properly packed and frozen to ensure that it retains its taste and holds the crisp once fried. Should be Kept Frozen at or below -18 C.",650.0,650.0,0.0,https://www.bigbasket.com/pd/40049578/gadre-fish-fingers-1-kg/?nc=cl-prod-list&t_pos_sec=1&t_pos_item=1&t_s=Fish%2520Fingers,4.1
12214,"Pork - Prosciutto Cotto Ham, Sliced","Eggs, Meat & Fish","Sausages, Bacon & Salami",Fresho Signature,475.2,528.0,Pork & Ham,3.9,"Dautore Prosciutto was first produced by Romans and is one of the oldest Italian deli meats. It was the Romans who left the first written descriptions of its production (cured). According to Italian tradition, large legs need to be used in order to obtain more mature meat, that contains less water. This condition is only passed by prosciutti crudi. They are marked as PDO or PGI once it has matured . Fresho Signature ProscicuttoCrudo Full P.G.I. is produced under the desired conditions to give it the authentic flavour. Manufactured at Italy. Packed as per Customer requirement. Not a standard pack under weights & Measurement Guidelines. Consume within 05 days from date of Packing. Store in refrigerator at or below 05 degree C in an airtight container.",475.2,475.2,10.000000000000002,https://www.bigbasket.com/pd/40094813/fresho-signature-pork-smoked-breakfast-ham-sliced-200-g/?nc=cl-prod-list&t_pos_sec=1&t_pos_item=1&t_s=Pork%2520-%2520Smoked%2520Breakfast%2520Ham%252C%2520Sliced,3.9
12216,Imitation - Crab Claw,"Eggs, Meat & Fish",Fish & Seafood,Gadre,600.0,600.0,Frozen Fish & Seafood,4.1,Gadre Crab Claw Just Fry is a fragrant medley of spices and aromatics. Its spicy punch is set off deliciously by the sweet crab meat. The flavour should be quite tart and spicy.,600.0,600.0,0.0,https://www.bigbasket.com/pd/40001531/gadre-imitation-crab-claw-250-g-carton/?nc=cl-prod-list&t_pos_sec=1&t_pos_item=3&t_s=Imitation%2520-%2520Crab%2520Claw,4.1
12362,Chicken - Cheese & Onion Sausages,"Eggs, Meat & Fish","Sausages, Bacon & Salami",Tannys,215.0,215.0,Chicken Sausages,4.3,"Chicken meat (60%), Ice & Water (18%), Onion (8%), Cheese (7%), Refined Palm oil (2%), Cereal binder (2%), Isolated soya protein, Iodized salt, Milk Powder, Mixed spices, Phosphates (E450, E451, E452), Onion flavor enchancer (E621), Anti oxidant (E300), Curing salt (E250), Permitted colour (E161g), Nutrition",215.0,215.0,0.0,https://www.bigbasket.com/pd/40020423/zorabian-chicken-cheese-n-onion-sausages-250-g-pouch/?nc=cl-prod-list&t_pos_sec=1&t_pos_item=4&t_s=Chicken%2520-%2520Cheese%2520N%2520Onion%2520Sausages,4.3
12473,"Country Cage Free Eggs - Medium, Antibiotic Residue-Free","Eggs, Meat & Fish",Eggs,Fresho,99.0,110.0,Organic Eggs,3.4,"Number of PcsSize6 pcsMediumThese desi brown eggs are laid by cage-free hens. These are sorted, graded and sanitised shells. These are very high in calcium and protein. These are hormone and anti-biotic free. These all-natural eggs are with a rich source of calcium and omega 3. The colour of the yolk is sunset orange. The Add-on Benefits of Fresho Egg: •Antibiotic free •Free from growth hormones •Carefully selected •Rich in omega 3 Fresho is our in-house brand of fresh meat, poultry, and seafood. We take utmost care in selecting the best suppliers to provide you with high quality and succulent products. Every product is stored in our cold storage right until your doorstep ensuring freshness and utmost hygiene.",99.0,99.0,10.0,https://www.bigbasket.com/pd/40185807/fresho-country-cage-free-eggs-medium-antibiotic-residue-free-6-pcs-tray/?nc=cl-prod-list&t_pos_sec=1&t_pos_item=2&t_s=Country%2520Cage%2520Free%2520Eggs-Medium,3.4
12543,Sausage - Chicken Cocktail,"Eggs, Meat & Fish","Sausages, Bacon & Salami",Elicious ,306.0,360.0,Chicken Sausages,3.9,"This chicken delight is a legendary classic in its own league. The perfect supplement to any buffet, breakfast or lunch.",306.0,306.0,15.0,https://www.bigbasket.com/pd/40003838/elicious-sausage-chicken-cocktail-400-g-pouch/?nc=cl-prod-list&t_pos_sec=1&t_pos_item=13&t_s=Sausage%2520-%2520Chicken%2520Cocktail,3.9
12698,Mutton Curry Cuts,"Eggs, Meat & Fish",Mutton & Lamb,Premier,450.0,450.0,Frozen Mutton,4.0,"Premium Mutton Curry Cuts are famous for their taste, texture and tenderness. It is cut into uniform pieces for consistent cooking time. Lamb meat comprises of Vitamin B, which is known to help one effectively burn fat. A little portion of this meat is good for those wanting to lose some weight. It is packed with Vitamin B12, which helps you get healthy skin. Mutton is also an outstanding source of many vitamins and minerals. It is deep red colour meat that has a strong flavour and is gamey.
Benefits

Handpicked fine quality tender and low-fat Mutton meat.
Premier Mutton curry cut is carved into perfect pieces to give you the ideal portion for your curries.
It is also an outstanding source of many vitamins and minerals.",450.0,450.0,0.0,https://www.bigbasket.com/pd/40215011/premier-mutton-mutton-curry-cuts-450-g/?nc=cl-prod-list&t_pos_sec=1&t_pos_item=1&t_s=Mutton%2520Curry%2520Cuts,4.0
12755,"Pork - Pizza Pepperoni, Sliced","Eggs, Meat & Fish","Sausages, Bacon & Salami",Fresho Signature,621.0,690.0,Pork & Ham,3.6,"Casanova Pepperoni is a spiced sausage cut into thin slices. It has varied shapes; when sliced, the inside looks red with grains of white/pink fat. The flavour is intense and appetizing and the smell is defined. Once matured, each salami type develops its own typical aroma. Manufactured at Spain. Packed as per Customer requirement. Not a standard pack under weights & Measurement Guidelines. Consume within 05 days from date of Packing. Store in refrigerator at or below 05 degree C in an airtight container.",621.0,621.0,10.0,https://www.bigbasket.com/pd/40037472/fresho-signature-artisan-herb-bread-pre-sliced-300-g/?nc=cl-prod-list&t_pos_sec=1&t_pos_item=4&t_s=Artisan%2520Herb%2520Bread%2520-%2520Pre-Sliced,3.6
12864,Eggs - Panchakavya,"Eggs, Meat & Fish",Eggs,Mpm,59.0,59.0,Other Eggs,2.8,MPMs Panchakavya Eggs are completely antibiotic and enhancer free and contain more nutrients than your regular broiler eggs. It is also effective in controlling ulcers and also help in reducing body heat. Panchakavya Eggs contain loads of medical characteristics.,59.0,59.0,0.0,https://www.bigbasket.com/pd/40129036/mpm-eggs-panchakavya-300-g/?nc=cl-prod-list&t_pos_sec=1&t_pos_item=1&t_s=Eggs%2520-%2520Panchakavya,2.8
13034,"Ham - Champagine Chicken, Smoked","Eggs, Meat & Fish","Sausages, Bacon & Salami",La Carne,250.0,250.0,Chicken Sausages,3.8,"Chicken meat (88%), Water, Commom salt, Dextose, yeast extract, soya, Edible Starch Anti-oxidant-300, Emulsifier-452, Colour fixative -250, white pepper, coriander, Contains permitted natural flavour.",250.0,250.0,0.0,https://www.bigbasket.com/pd/40063434/la-carne-ham-chicken-pariser-smoked-150-g-pouch/?nc=cl-prod-list&t_pos_sec=1&t_pos_item=4&t_s=Ham%2520-%2520Chicken%2520Pariser%252C%2520Smoked,3.8
13076,"Pork - Salami Napoli, Sliced","Eggs, Meat & Fish","Sausages, Bacon & Salami",Fresho Signature,282.6,314.0,Pork & Ham,4.1,"Dautore Italian salami Napoli are differentiated on the basis of type of meat grinding (fine, medium or coarse) and the spices and ingredients (garlic, chilli pepper, fennel seeds) used. These ingredients and grinding type gives every type of Salami, a very specific personality and shape. The shapes are generally elongated and vary in sizes. When sliced, the salami looks red with grains of white/pink fat on the inside. Fresho Signature has an intense flavour and appetizing. It also has a very clearly defined smell. Meat, fat and other possible ingredients are minced together, put into casings and matured. Once the salami has matured, it develops its own typical and distinct aroma. Manufactured at Italy. Packed as per Customer requirement. Not a standard pack under weights & Measurement Guidelines. Consume within 05 days from date of Packing. Store in refrigerator at or below 05 degree C in an airtight container.",282.6,282.6,9.999999999999991,https://www.bigbasket.com/pd/40263039/fresho-chicken-salami-sliced-spicy-ready-to-fry-rich-in-protein-500-g/?nc=cl-prod-list&t_pos_sec=1&t_pos_item=13&t_s=Chicken%2520Salami%2520Sliced%252C%2520Spicy,4.1
13079,Mutton Seekh Kebab,"Eggs, Meat & Fish",Mutton & Lamb,La Carne,475.0,475.0,Frozen Mutton,4.1,"At La Carne, we take pride in offering products of high quality. La Carne brings to you the authentic taste of premium Mutton Products. Quick Freezing technology used to preserve all the goodness and freshness inside. Made with best of mutton, which is lean with low fat. Mutton Kebab is juicy and tender & spiced to perfection.",475.0,475.0,0.0,https://www.bigbasket.com/pd/40162599/la-carne-mutton-seekh-kebab-500-g-pkt/?nc=cl-prod-list&t_pos_sec=1&t_pos_item=2&t_s=Mutton%2520Seekh%2520Kebab,4.1
13235,Eggs - Free Range,"Eggs, Meat & Fish",Eggs,Farm Made,122.0,130.0,Farm Eggs,3.8,"Our infertile free range eggs are produced using traditional farming methods, ensuring highest animal protection standards. Our hens are pasture raised and humanely treated. These eggs do not contain antibiotics, growth promoters, hormones or any such substances.Our eggs are rich in omega 3, protein and vitamins. These hens enjoy a lot of free space, a lot of greens to feed on, a spacious place to rest along with areas for playing and a lot of fresh air. It is 100% natural free range eggs.",122.0,122.0,6.153846153846154,https://www.bigbasket.com/pd/40117922/farm-made-eggs-free-range-12-pcs/?nc=cl-prod-list&t_pos_sec=1&t_pos_item=1&t_s=Free%2520Range%2520Eggs,3.8
13269,"Sausage - Pork, Super Bacon","Eggs, Meat & Fish",Pork & Other Meats,Quickee'S,230.0,230.0,Pork & Ham,3.8,Quickee presents their deliciously mouth-watering range of meat products which will enchant your taste buds and leave you craving for more as you rake up your favourite meals. Quickees Super Bacon Pork sausages are made from the freshest and most tender part of pork giving it the juicy and tender texture that will make you crave for more.,230.0,230.0,0.0,https://www.bigbasket.com/pd/40125075/quickees-sausage-pork-goan-275-g/?nc=cl-prod-list&t_pos_sec=1&t_pos_item=2&t_s=Sausage%2520-%2520Pork%252C%2520Goan,3.8
13311,Fresho Meat Mutton - Biryani Pieces 1 kg + Jharna Ghee 250 gm,"Eggs, Meat & Fish",Mutton & Lamb,bb Combo,579.0,579.0,Frozen Mutton,3.2,"It is used for preparation of tasty mutton biryani, kebabs and non vegetable recipes. This cube contains mouth watering taste when cooked properly using oil, spices and salt. It is fried also and is served as side along with rice.
 Ghee is an integral component of Bengali cuisine as no Moong Dal would be complete without a drizzle of Jharna Ghee or no Niramish tarkari (vegetable curry) would taste good without a fresh dose of ground garam masala and a dash of Jharna Ghee.",579.0,579.0,0.0,n/a,3.2
