index,product,category,sub_category,brand,sale_price,market_price,type,rating_clean,description,sale_price_original,sale_price_capped,discount_pct,product_url,rating_value
4575,Chicken Sausage,"Eggs, Meat & Fish","Sausages, Bacon & Salami",Fresho,171.6,220.0,Chicken Sausages,4.0,"Chicken Sausage is made with premium ingredients, giving you the perfect blend of flavours. Easy to cook, this is a perfect option to tame your hunger pangs. Indulge in some premium taste with Fresho.",171.6,171.6,22.000000000000004,https://www.bigbasket.com/pd/40263033/fresho-chicken-sausages-masala-ready-to-fry-rich-in-protein-500-g/?nc=cl-prod-list&t_pos_sec=1&t_pos_item=11&t_s=Chicken%2520Sausage%252C%2520Masala,4.0
4610,Chicken - Salami,"Eggs, Meat & Fish","Sausages, Bacon & Salami",Zorabian,165.0,165.0,Chicken Sausages,4.3,"ZorabianÃƒÆ’Ã‚Â¢ÃƒÂ¢Ã¢â‚¬Å¡Ã‚Â¬ÃƒÂ¢Ã¢â‚¬Å¾Ã‚Â¢s Chicken Salami is an absolute treat ÃƒÆ’Ã‚Â¢ÃƒÂ¢Ã¢â‚¬Å¡Ã‚Â¬ÃƒÂ¢Ã¢â€šÂ¬Ã…â€œ With Subtle FlavouringÃƒÆ’Ã‚Â¢ÃƒÂ¢Ã¢â‚¬Å¡Ã‚Â¬ÃƒÂ¢Ã¢â‚¬Å¾Ã‚Â¢s ÃƒÆ’Ã‚Â¢ÃƒÂ¢Ã¢â‚¬Å¡Ã‚Â¬ÃƒÂ¢Ã¢â€šÂ¬Ã…â€œ It is fabulous to have with your eggs at Breakfast ÃƒÆ’Ã‚Â¢ÃƒÂ¢Ã¢â‚¬Å¡Ã‚Â¬ÃƒÂ¢Ã¢â€šÂ¬Ã…â€œ It also makes a great sandwich, pizza topping and is a tiffin box favourite.",165.0,165.0,0.0,https://www.bigbasket.com/pd/40020427/zorabian-chicken-spicy-salami-250-g-pouch/?nc=cl-prod-list&t_pos_sec=1&t_pos_item=4&t_s=Chicken%2520-%2520Spicy%2520Salami,4.3
4705,Medium Prawns - Peeled & Deveined,"Eggs, Meat & Fish",Fish & Seafood,Buffet ,260.0,260.0,Frozen Fish & Seafood,3.7,"Buffet prawns are fresh from the sea, individually fast frozen medium sized prawns that are peeled and deveined for your ease. Our freezing and vacuum packing technology minimizes breakage and makes sure that the freshness of all prawn is locked in.",260.0,260.0,0.0,https://www.bigbasket.com/pd/40001201/buffet-medium-prawns-peeled-deveined-250-g-pouch/?nc=cl-prod-list&t_pos_sec=1&t_pos_item=3&t_s=Medium%2520Prawns%2520-%2520Peeled%2520%2526%2520Deveined,3.7
4719,Ready to Cook - Prawn Small,"Eggs, Meat & Fish",Fish & Seafood,Britte ,160.0,160.0,Frozen Fish & Seafood,3.7,"Britte Small Prawn is a ready to cook product, produced as just cleaning and freezing domestic areas. It is an excellent supply of protein and is low in fat. It is also an excellent source of Omega 3 EPA + DHA. You can have A vitamin and zinc. Also, you can create antioxidant source and strengthen your immune system against cancer.",160.0,160.0,0.0,https://www.bigbasket.com/pd/40001204/buffet-ready-to-cook-small-prawns-peeled-deveined-250-g-pouch/?nc=cl-prod-list&t_pos_sec=1&t_pos_item=1&t_s=Ready%2520to%2520Cook%2520-%2520Small%2520Prawns%2520%2528Peeled%2520%2526%2520Deveined%2529,3.7
4754,Pork Premium Bacon,"Eggs, Meat & Fish","Sausages, Bacon & Salami",La Carne,375.0,375.0,Pork & Ham,4.2,"At La Carne, we take pride in offering products of high quality. La Carne brings to you the authentic taste of premium Imported Pork Products. Quick Freezing technology used to preserve all the goodness and freshness inside. Made with best of European Pork meat, which is lean with low fat. Natural wood smoked pork bacon star of American style bacon.",375.0,375.0,0.0,https://www.bigbasket.com/pd/40161849/la-carne-pork-premium-bacon-250-g-pkt/?nc=cl-prod-list&t_pos_sec=1&t_pos_item=2&t_s=Pork%2520Premium%2520Bacon,4.2
4760,"Roopchand Fish - Slice, Preservative Free, 10-14 pcs","Eggs, Meat & Fish",Fish & Seafood,Fresho,185.0,249.0,Fresh Fish,3.5,"Net WeightNumber Of PcsServing SizeStorage Temp500 g10-144-5 people0-4 deg celThis single bone freshwater fish and have no strong odour. They are mainly fried or steamed. These fish are packed with protein and omega acid. This helps you to build a healthy body. This steak sliced roopchand fish comes without the head. It is cleaned and gutted. This comes in 10-14 pcs which are perfect for 4-5 people. It is preservative-free. Fresho is our in-house brand of fresh meat, poultry, and seafood. We take utmost care in selecting the best suppliers to provide you with high quality and succulent products. Every product is stored in our cold storage right until your doorstep ensuring freshness and utmost hygiene.",185.0,185.0,25.70281124497992,https://www.bigbasket.com/pd/40037465/fresho-white-big-bread-slices-safe-preservative-free-400-g/?nc=cl-prod-list&t_pos_sec=1&t_pos_item=11&t_s=White%2520Jumbo%2520Bread%2520Slices%2520-%2520Preservative%2520Free,3.5
4796,Malabar Trevally Fish (Medium) - Boneless,"Eggs, Meat & Fish",Fish & Seafood,Fresho,1249.0,1249.0,Fresh Fish,3.2,"Fresho Meats is our in house brand of fresh meat, poultry and seafood. We take utmost care in selecting the best suppliers to provide you with high quality and succulent products. Every product is stored in our cold storage right until your doorstep ensuring freshness and utmost hygiene. Additionally, every product is packed using food grade plastic which provides a nourishing and wholesome environment.",1249.0,1249.0,0.0,https://www.bigbasket.com/pd/40231713/fresho-barbeque-pepper-fish-juicy-fresh-250-g-vaccum/?nc=cl-prod-list&t_pos_sec=1&t_pos_item=36&t_s=BBQ%2520Pepper%2520Fish%2520Cubes,3.2
4868,Chicken Nuremberg,"Eggs, Meat & Fish","Sausages, Bacon & Salami",Fresho,243.0,270.0,Chicken Sausages,4.2,"Chicken Nuremberg is made with premium ingredients, giving you the perfect blend of flavours. Easy to cook, this is a perfect option to tame your hunger pangs. Indulge in some premium taste with Fresho.",243.0,243.0,10.0,https://www.bigbasket.com/pd/40020420/zorabian-chicken-sausages-250-g-pouch/?nc=cl-prod-list&t_pos_sec=1&t_pos_item=1&t_s=Chicken%2520-%2520Sausages,4.2
4906,Chicken Seekh Kabab - Lahori,"Eggs, Meat & Fish","Sausages, Bacon & Salami",Fresho,264.65,335.0,Chicken Sausages,4.2,"Kebabs are popular all over the world for all the right reasons. Seekh Kababs are a very popular appetiser and delicacy in most parts of the world. They are made from tender meat, add some masalas and seasoning, put it on a skewer and grilled them golden. These are not only delicious and tasty, but easy to eat but are also full of health, especially if you make them the ‘healthy way’. This Chicken Seekh Kebabs requires just a few minutes of your time and believe us, each effort that goes into making them is so worth it. Get your hands on Fresho Chicken Seekh Kabab and start cooking this mouth-watering and delicious Kebabs and serve them with hot parathas and green chutney.

Chicken kebabs are one of the most valued foods among people of all ages, throughout the world. 
Not only it forms a crucial part of various culinary traditions but it is also highly nutritious and delicious to taste. 
Seekh Kababs are a very popular appetiser and delicacy non-vegetarian snacks to be served quickly in most parts of the world.",264.65,264.65,21.000000000000007,https://www.bigbasket.com/pd/40020425/zorabian-chicken-seekh-kebab-250-g-pouch/?nc=cl-prod-list&t_pos_sec=1&t_pos_item=1&t_s=Chicken%2520-%2520Seekh%2520Kebab,4.2
4927,Chicken Breast Ham Chilli,"Eggs, Meat & Fish","Sausages, Bacon & Salami",Bon Appetit,152.0,162.0,Chicken Sausages,3.8,"Pieces form the lean fat free chicken breast filled with chili flakes oversmoked with natural wood smoke. Useable for Salad, Fingerfoods and Sandwiches.",152.0,152.0,6.172839506172839,https://www.bigbasket.com/pd/900457834/meisterwurst-chicken-chilli-ham-breast-sausages-200-g-pouch/?nc=cl-prod-list&t_pos_sec=1&t_pos_item=1&t_s=Chicken%2520Chilli%2520Ham%2520Breast%2520-Poultry%2520Meat%2520%2528Chicken%2529%252090%2525%252CNo%2520soya,3.8
5171,"Farm Quail Eggs - Small, Antibiotic Residue-Free","Eggs, Meat & Fish",Eggs,Fresho,69.0,75.0,Other Eggs,3.3,"Number of PcsSize12 pcsSmallThough smaller in size than chicken eggs, quail eggs contain more fat, protein, iron, and vitamin. It is packed with health-promoting antioxidants helping in cellular damage. It is a delicacy in different Asian countries like Indonesia, Japan, and South Korea. There are a variety of dishes one can cook with this egg. The Add-on Benefits of Fresho Egg: •Antibiotic free •Free from growth hormones •Carefully selected •Rich in omega 3 Fresho is our in-house brand of fresh meat, poultry, and seafood. We take utmost care in selecting the best suppliers to provide you with high quality and succulent products. Every product is stored in our cold storage right until your doorstep ensuring freshness and utmost hygiene.",69.0,69.0,8.0,https://www.bigbasket.com/pd/40185809/fresho-farm-no-hatch-herbal-eggs-medium-antibiotic-residue-free-6-pcs-box/?nc=cl-prod-list&t_pos_sec=1&t_pos_item=2&t_s=Farm%2520No-Hatch%2520Herbal%2520Eggs%2520-%2520Medium%252C%2520Antibiotic%2520Residue-Free,3.3
5207,Mutton Boneless Cubes,"Eggs, Meat & Fish",Mutton & Lamb,Premier,600.0,600.0,Frozen Mutton,4.0,"Premium Boneless Mutton Cubes are famous for their taste, texture and tenderness. It is cut into uniform pieces for consistent cooking time. Lamb meat comprises of Vitamin B, which is known to help one effectively burn fat. A little portion of this meat is good for those wanting to lose some weight. It is packed with Vitamin B12, which helps you get healthy skin. Mutton is also a outstanding source of many vitamins and minerals. It is deep red colour meat that has a strong flavour and is gamey.
Benefits

Handpicked fine quality tender and low-fat Mutton meat.
Mutton Cubes with all the hard stuff removed.
It is also an outstanding source of many vitamins and minerals.",600.0,600.0,0.0,https://www.bigbasket.com/pd/40215011/premier-mutton-mutton-curry-cuts-450-g/?nc=cl-prod-list&t_pos_sec=1&t_pos_item=1&t_s=Mutton%2520Curry%2520Cuts,4.0
5292,Fish Fillet - Breaded,"Eggs, Meat & Fish",Fish & Seafood,Seastar,210.0,210.0,Frozen Fish & Seafood,2.9,Seastar Fish Fillet - Breaded 250 g,210.0,210.0,0.0,https://www.bigbasket.com/pd/40018640/seastar-fish-fillet-breaded-250-g-carton/?nc=cl-prod-list&t_pos_sec=1&t_pos_item=1&t_s=Fish%2520Fillet%2520-%2520Breaded,2.9
5359,"Tilapia Fish Fillet - Preservative Free, 8-12 pcs","Eggs, Meat & Fish",Fish & Seafood,Fresho,450.0,499.0,Fresh Fish,2.9,"Net WeightNumber Of PcsServing SizeStorage Temp500 g8-126-8 people0-4 deg celTilapia is a freshwater fish which is commonly made in Indian’s kitchen. It has a mild fishy flavour. Packed with protein and nutrients, it is rich in niacin, vitamin B12, phosphorus, selenium and potassium. This boneless fillet comes without the head. This comes in 8-12 pcs which are perfect for 6-8 people. It is  preservative-free. Fresho is our in-house brand of fresh meat, poultry, and seafood. We take utmost care in selecting the best suppliers to provide you with high quality and succulent products. Every product is stored in our cold storage right until your doorstep ensuring freshness and utmost hygiene.",450.0,450.0,9.819639278557114,https://www.bigbasket.com/pd/40075994/fresho-tilapia-fish-fillet-preservative-free-8-12-pcs-500-g/?nc=cl-prod-list&t_pos_sec=1&t_pos_item=1&t_s=Tilapia%2520Fish%2520Fillet,2.9
5531,Pork Premium Ham,"Eggs, Meat & Fish","Sausages, Bacon & Salami",La Carne,275.0,275.0,Pork & Ham,4.2,"At La Carne, we take pride in offering products of high quality. La Carne brings to you the authentic taste of premium Imported Pork Products. Quick Freezing technology used to preserve all the goodness and freshness inside. Made with best of European Pork meat, which is lean with low fat. Pork Ham is richly flavoured and traditional.",275.0,275.0,0.0,https://www.bigbasket.com/pd/40162598/la-carne-pork-premium-ham-250-g-pkt/?nc=cl-prod-list&t_pos_sec=1&t_pos_item=2&t_s=Pork%2520Premium%2520Ham,4.2
5537,Canned Mackerel In - Brine,"Eggs, Meat & Fish",Fish & Seafood,Golden Prize,113.05,119.0,Canned Seafood,4.3,"Premium Quality Fish, Imported from Thailand, Excellent source of Omega 3",113.05,113.05,5.000000000000003,https://www.bigbasket.com/pd/40037995/golden-prize-canned-mackerel-in-brine-200-g/?nc=cl-prod-list&t_pos_sec=1&t_pos_item=1&t_s=Canned%2520Mackerel%2520In%2520-%2520Brine,4.3
5573,Canned Sardine - in Natural Oil with Chili,"Eggs, Meat & Fish",Fish & Seafood,Golden Prize,75.05,79.0,Canned Seafood,4.4,"Golden Prize Canned Sardine in Natural Oil with Chili is rich in Omega 3 and can be used to prepare a variety of delicious dishes, or can be eaten straight from the can. These sardines are a product of Thailand and come in an easy to open lid can. They are dolphin safe and HACCP compliant.",75.05,75.05,5.000000000000004,https://www.bigbasket.com/pd/40096826/golden-prize-canned-sardine-in-natural-oil-with-chili-200-g/?nc=cl-prod-list&t_pos_sec=1&t_pos_item=1&t_s=Canned%2520Sardine%2520in%2520Natural%2520Oil%2520with%2520Chili,4.4
5580,Dabur Hommade - Coconut Milk 200ml + ITC Master Chef Prawns - Super Large 200gm,"Eggs, Meat & Fish",Fish & Seafood,bb Combo,340.97,350.0,Frozen Fish & Seafood,4.2,"Dabur Hommade goes beyond its popular range of cooking pastes to elevate the tastes of Indian homemade recipes with Coconut Milk. Made from the first pressed extract of top-grade coconuts, this culinary delight carries a rich taste and thick texture that makes your dishes much fuller and creamier.",340.97,340.97,2.5799999999999925,https://www.bigbasket.com/pd/40110126/itc-master-chef-prawns-super-large-peeled-deveined-200-g/?nc=cl-prod-list&t_pos_sec=1&t_pos_item=1&t_s=Super%2520Large%2520Prawns,4.2
5724,Atlantic Salmon - Fillet,"Eggs, Meat & Fish",Fish & Seafood,Big Sams,1190.0,1190.0,Frozen Fish & Seafood,4.0,"Big Sams is a well-known international brand which offers a range of quality frozen seafood. The raw salmon fillets provided by Big Sams is trimmed and cut into a fillet portion so that it is easy to cook. The skin is kept as intact as some people like the skin of the salmon on their fillet. They are hygienically processed under strict conditions, so that the fish reaches your home in its fresh best.",1190.0,1190.0,0.0,https://www.bigbasket.com/pd/40021108/big-sams-atlantic-salmon-fillet-300-g-pouch/?nc=cl-prod-list&t_pos_sec=1&t_pos_item=2&t_s=Atlantic%2520Salmon%2520-%2520%2520Skinless%2520Fillet,4.0
5800,"Ham - Pork, Luncheon","Eggs, Meat & Fish","Sausages, Bacon & Salami",Quickee'S,285.0,285.0,Pork & Ham,2.9,Quickee presents their deliciously mouth-watering range of meat products which will enchant your taste buds and leave you craving for more as you rake up your favourite meals. Use Quickees Pork Luncheon Ham to make your favourite sandwiches and subs with fresh vegetables in order to rake up a delectable meal for your family and friends.,285.0,285.0,0.0,n/a,2.9
5929,"Country Eggs - Kadaknath, Small, Antibiotic Residue-Free","Eggs, Meat & Fish",Eggs,Fresho,115.0,125.0,Country Eggs,3.4,"Number of PcsSize6 pcsSmallKadaknath egg is one of the rare variety of eggs in the country. It increases the high protein level in the human body. The origin of eggs is from Madhya Pradesh. The Add-on Benefits of Fresho Egg: • Antibiotic free • Free from growth hormones • Carefully selected • Rich in omega 3 Fresho is our in-house brand of fresh meat, poultry, and seafood. We take utmost care in selecting the best suppliers to provide you with high quality and succulent products. Every product is stored in our cold storage right until your doorstep ensuring freshness and utmost hygiene.",115.0,115.0,8.0,https://www.bigbasket.com/pd/40185807/fresho-country-cage-free-eggs-medium-antibiotic-residue-free-6-pcs-tray/?nc=cl-prod-list&t_pos_sec=1&t_pos_item=6&t_s=Country%2520Cage%2520Free%2520Eggs-Medium,3.4
5956,Ferra Fish,"Eggs, Meat & Fish",Fish & Seafood,H.S. Dry Fish,59.5,70.0,Dry Fish,3.8,"The oldest traditional way of preserving fish is drying, and is still considered one of the most effective preservation methods.",59.5,59.5,15.0,https://www.bigbasket.com/pd/40036193/hs-dry-fish-ferra-fish-80-g/?nc=cl-prod-list&t_pos_sec=1&t_pos_item=1&t_s=Ferra%2520Fish,3.8
5979,Sausage - Chicken with Chives,"Eggs, Meat & Fish","Sausages, Bacon & Salami",Bon Appetit,292.0,312.0,Chicken Sausages,4.4,"EAN Code: 8908002778786  Country of origin: India  Manufactured & Marketed by: Arthur's Food Company Private Limited, NO 14H KIADB Industrial area, Attibele,Bangalore - 562107, Karnataka, India  Best before 18-10-2021  For Queries/Feedback/Complaints, Contact our Customer Care Executive at: Phone: 1860 123 1000 | Address: Innovative Retail Concepts Private Limited, No.18, 2nd & 3rd Floor, 80 Feet Main Road, Koramangala 4th Block, Bangalore - 560034 | Email: customerservice@bigbasket.com",292.0,292.0,6.41025641025641,https://www.bigbasket.com/pd/40339772/carnivore-chicken-cheese-onion-sausages-250-g/?nc=cl-prod-list&t_pos_sec=1&t_pos_item=3&t_s=Chicken%2520%2526%2520Cheese%2520Onion%2520Sausages,4.4
6018,Chicken Seekh Kabab Nawabi,"Eggs, Meat & Fish","Sausages, Bacon & Salami",Fresho,254.0,330.0,Chicken Sausages,4.2,"Prepared in the traditional style, the kebabs are made with the finest hand-picked spices. enjoy these delicious kababs at the convenience of your home. Perfect as a starter, relish these mouth-watering delight with your loved ones. Fresho is our in-house brand of fresh meat, poultry, and seafood. We take utmost care in selecting the best suppliers to provide you with high quality and succulent products. Every product is stored in our cold storage right until your doorstep ensuring freshness and utmost hygiene.",254.0,254.0,23.03030303030303,https://www.bigbasket.com/pd/40020425/zorabian-chicken-seekh-kebab-250-g-pouch/?nc=cl-prod-list&t_pos_sec=1&t_pos_item=1&t_s=Chicken%2520-%2520Seekh%2520Kebab,4.2
6069,Sardine In Tomato Sauce,"Eggs, Meat & Fish",Fish & Seafood,Indofish,70.0,70.0,Canned Seafood,4.4,"Indofish Sardine in Tomato Sauce is  ready to eat and is a rich source of Omega 3. It comes with an easy to open lid and can be stored for longer than fresh fish. It is an ideal ingredient to be used for preparing flavourful fish curries, salads or pastas.",70.0,70.0,0.0,https://www.bigbasket.com/pd/40096825/golden-prize-canned-sardine-in-tomato-sauce-200-g/?nc=cl-prod-list&t_pos_sec=1&t_pos_item=1&t_s=Canned%2520Sardine%2520in%2520Tomato%2520Sauce,4.4
6125,Chicken Bell Pepper Salami,"Eggs, Meat & Fish","Sausages, Bacon & Salami",La Carne,150.0,150.0,Chicken Sausages,4.2,"At La Carne, we take pride in offering products of high quality. La Carne brings to you the authentic taste of premium Chicken Products. Quick Freezing technology used to preserve all the goodness and freshness inside. Made with lean ground chicken with low fat. Chicken Salami with engraved Bell Peppers serves as anytime snack. Perfect snack or Salad combo for any meal of the day.",150.0,150.0,0.0,https://www.bigbasket.com/pd/40161839/la-carne-chicken-bell-pepper-salami-250-g-pkt/?nc=cl-prod-list&t_pos_sec=1&t_pos_item=2&t_s=Chicken%2520Bell%2520Pepper%2520Salami,4.2
6178,"Pork - D Shape Cooked Breakfast Ham, Sliced","Eggs, Meat & Fish","Sausages, Bacon & Salami",Fresho Signature,171.6,190.67,Pork & Ham,3.9,"Bauwens D-Shaped hams is perfectly sliced, has a great plate coverage and eye appeal. They also appear less processed and each ham is hand-processed to remove the bone. The included muscles are separated and closely trimmed of fat before the ham is shaped and slow-smoked on hardwood. Manufactured at USA. Packed as per Customer requirement. Not a standard pack under weights & Measurement Guidelines. Consume within 05 days from date of Packing. Store in refrigerator at or below 05 degree C in an airtight container.",171.6,171.6,10.001573399066448,https://www.bigbasket.com/pd/40094813/fresho-signature-pork-smoked-breakfast-ham-sliced-200-g/?nc=cl-prod-list&t_pos_sec=1&t_pos_item=1&t_s=Pork%2520-%2520Smoked%2520Breakfast%2520Ham%252C%2520Sliced,3.9
6254,"Chicken - Momos, Spicy","Eggs, Meat & Fish","Sausages, Bacon & Salami",Prasuma,295.0,295.0,Chicken Sausages,4.2,"Made with premium ingredients and no preservatives, each Prasuma Momo is crafted with thin wrappers that allow for a larger filling-to-wrapper ratio, these bite-sized treats are full of flavour and easy to prepare. Prasuma Momos can be microwaved, pan-fried, steamed or deep fried and ready to eat in as little as 2 minutes.",295.0,295.0,0.0,https://www.bigbasket.com/pd/40177263/prasuma-chicken-momos-spicy-24-pcs/?nc=cl-prod-list&t_pos_sec=1&t_pos_item=2&t_s=Spicy%2520Chicken%2520Momos,4.2
6497,Canned Mackerel In - Tomato Sauce With Chili,"Eggs, Meat & Fish",Fish & Seafood,Golden Prize,113.05,119.0,Canned Seafood,4.1,"Premium Quality Fish, Imported from Thailand, Excellent source of Omega 3",113.05,113.05,5.000000000000003,https://www.bigbasket.com/pd/40037996/golden-prize-canned-mackerel-in-tomato-sauce-with-chili-200-g/?nc=cl-prod-list&t_pos_sec=1&t_pos_item=1&t_s=Canned%2520Mackerel%2520In%2520-%2520Tomato%2520Sauce%2520With%2520Chili,4.1
6524,Pink Salmon In Oil,"Eggs, Meat & Fish",Fish & Seafood,Golden Prize,308.75,325.0,Canned Seafood,3.9,"Golden Prize Salmon In Oil is ready to eat and is a rich source of Omega 3. It comes with an easy to open lid and can be stored for longer than fresh fish. It is an ideal ingredient to be used for preparing flavourful fish curries, salads or pastas.",308.75,308.75,5.0,https://www.bigbasket.com/pd/40124072/golden-prize-smoked-pink-salmon-fillet-wild-alaskan-in-oil-115-g/?nc=cl-prod-list&t_pos_sec=1&t_pos_item=2&t_s=Smoked%2520Pink%2520Salmon%2520Fillet%2520-%2520Wild%2520Alaskan%252C%2520In%2520Oil,3.9
6642,Chicken Frankfurter,"Eggs, Meat & Fish","Sausages, Bacon & Salami",Fresho,212.8,280.0,Chicken Sausages,4.0,"Chicken Frankfurter is made with premium ingredients, giving you the perfect blend of flavours. Easy to cook, this is a perfect option to tame your hunger pangs. Indulge in some premium taste with Fresho.",212.8,212.8,24.0,https://www.bigbasket.com/pd/40263037/fresho-chicken-frankfurter-ready-to-fry-rich-in-protein-500-g/?nc=cl-prod-list&t_pos_sec=1&t_pos_item=2&t_s=Chicken%2520Frankfurter,4.0
6737,Prawns - Pud Small,"Eggs, Meat & Fish",Fish & Seafood,Seastar,170.0,170.0,Frozen Fish & Seafood,2.9,Seastar Prawns - Pud Small 250 g,170.0,170.0,0.0,https://www.bigbasket.com/pd/40018655/seastar-prawns-pud-small-250-g-pouch/?nc=cl-prod-list&t_pos_sec=1&t_pos_item=1&t_s=Prawns%2520-%2520Pud%2520Small,2.9
6934,Rohu Fish (Large) - Curry Cut/Bengali Cut 1 kg + Mutton - Curry Cut 1 kg,"Eggs, Meat & Fish",Fish & Seafood,Fresho,1155.0,1948.0,Fresh Fish,3.0,"Product weighed before cleaning and cutting. Net weight will be lower at the time of delivery because of cleaning and Processing weight loss
 Fresho Meats is our in house brand of fresh meat, poultry and seafood. We take utmost care in selecting the best suppliers to provide you with high quality and succulent products. Every product is stored in our cold storage right until your doorstep ensuring freshness and utmost hygiene. Additionally, every product is packed using food grade plastic which provides a nourishing and wholesome environment. Freshly processed & Clean curry pieces ready for cooking.",1155.0,1155.0,40.70841889117043,n/a,3.0
7086,Fresh Catch Prawns - Medium,"Eggs, Meat & Fish",Fish & Seafood,Ifb,200.0,200.0,Frozen Fish & Seafood,3.5,"IFB Fresh Catch brings you premium quality prawns from the warm coastal waters of Bengal. It is quickly frozen to ensure consistency and freshness. Upon being thawed and cooked, the natural juices of the prawns are released making it soft and succulent. By purchasing these prawns, you will be supporting a community of dedicated Aqua Farmers committed to preserve the health of their home and the environment, for years to come.",200.0,200.0,0.0,https://www.bigbasket.com/pd/40004054/ifb-fresh-catch-prawns-medium-200-g-pouch/?nc=cl-prod-list&t_pos_sec=1&t_pos_item=1&t_s=Fresh%2520Catch%2520Prawns%2520-%2520Medium,3.5
7118,Fresh Boneless Chicken Breast,"Eggs, Meat & Fish","Sausages, Bacon & Salami",Meatzza,240.0,240.0,Chicken Sausages,3.7,"Breast pieces processed from dressed whole bird. Very soft and tender in nature, ideal for roasting and good to use in dry heat. Should be Kept Frozen at or below -18 C",240.0,240.0,0.0,https://www.bigbasket.com/pd/40055084/meatzza-fresh-boneless-chicken-breast-500-g/?nc=cl-prod-list&t_pos_sec=1&t_pos_item=4&t_s=Boneless%2520Chicken%2520Breast,3.7
